{
  "format": "wall-autotile",
  "version": 2,
  "id": "your-stage-v1",
  "themes": [
    "your-zone"
  ],
  "image": "autotile-32.png?v=bac5b9616dbc",
  "tileSize": 32,
  "rise": 0.75,
  "width": 128,
  "height": 280,
  "neighbors": 4,
  "bitOrder": [
    "north",
    "east",
    "south",
    "west"
  ],
  "material": {
    "format": "wall-material",
    "version": 1,
    "id": "your-stage-v1",
    "capPixels": 32,
    "facePixels": 24,
    "light": "north-west",
    "entranceMode": "integrated"
  },
  "tiles": {
    "0": [
      [
        0,
        0,
        32,
        56
      ]
    ],
    "1": [
      [
        32,
        0,
        32,
        56
      ]
    ],
    "2": [
      [
        64,
        0,
        32,
        56
      ]
    ],
    "3": [
      [
        96,
        0,
        32,
        56
      ]
    ],
    "4": [
      [
        0,
        56,
        32,
        56
      ]
    ],
    "5": [
      [
        32,
        56,
        32,
        56
      ]
    ],
    "6": [
      [
        64,
        56,
        32,
        56
      ]
    ],
    "7": [
      [
        96,
        56,
        32,
        56
      ]
    ],
    "8": [
      [
        0,
        112,
        32,
        56
      ]
    ],
    "9": [
      [
        32,
        112,
        32,
        56
      ]
    ],
    "10": [
      [
        64,
        112,
        32,
        56
      ]
    ],
    "11": [
      [
        96,
        112,
        32,
        56
      ]
    ],
    "12": [
      [
        0,
        168,
        32,
        56
      ]
    ],
    "13": [
      [
        32,
        168,
        32,
        56
      ]
    ],
    "14": [
      [
        64,
        168,
        32,
        56
      ]
    ],
    "15": [
      [
        96,
        168,
        32,
        56
      ]
    ]
  },
  "entrances": {
    "leftJamb": [
      [
        0,
        224,
        32,
        56
      ]
    ],
    "rightJamb": [
      [
        32,
        224,
        32,
        56
      ]
    ],
    "lintel": [
      [
        64,
        224,
        32,
        56
      ]
    ],
    "threshold": [
      [
        96,
        224,
        32,
        56
      ]
    ]
  }
}
